{
  "$schema": "https://json-schema.org/draft/2020-12/schema",
  "$id": "https://reader-core-native/reader-command.schema.json",
  "title": "Reader Core Command Protocol",
  "description": "JSON message protocol for platform → Core commands.",
  "x-reader-core-v1-capabilities": [
    "core.info",
    "runtime.ping",
    "runtime.hostSmoke",
    "runtime.cancel",
    "runtime.status",
    "runtime.shutdown",
    "host.complete",
    "host.error",
    "host.bus.v1",
    "http.execute",
    "runtime.config.v1",
    "remote.reading.v1"
  ],
  "type": "object",
  "additionalProperties": false,
  "required": ["protocolVersion", "requestId", "method"],
  "properties": {
    "protocolVersion": {
      "type": "integer",
      "const": 1,
      "description": "Protocol version. Must be 1."
    },
    "requestId": {
      "type": "integer",
      "minimum": 1,
      "description": "Unique positive request identifier for correlation. Value 0 is reserved for process-level errors emitted outside a host command."
    },
    "method": {
      "type": "string",
      "minLength": 1,
      "pattern": "^[^\\s.]+(\\.[^\\s.]+)+$",
      "description": "Command method name, dot-separated. Must contain two or more non-empty tokens and no whitespace.",
      "examples": [
        "core.info",
        "runtime.ping",
        "runtime.hostSmoke",
        "runtime.cancel",
        "runtime.status",
        "runtime.shutdown",
        "host.complete",
        "host.error",
        "source.import",
        "book.search",
        "book.detail",
        "book.toc",
        "chapter.content",
        "reading.progress.update"
      ]
    },
    "params": {
      "type": "object",
      "default": {},
      "description": "Method-specific parameters."
    }
  },
  "$defs": {
    "HostCompleteParams": {
      "type": "object",
      "additionalProperties": false,
      "required": ["operationId", "result"],
      "properties": {
        "operationId": { "type": "integer", "minimum": 1 },
        "result": {
          "description": "Host capability result payload. For http.execute remote-reading continuations, see #/$defs/HostHttpResponse.",
          "type": "object"
        }
      }
    },
    "HostHttpResponse": {
      "type": "object",
      "additionalProperties": true,
      "required": ["body"],
      "description": "Result payload accepted when completing a host.request with capability http.execute.",
      "properties": {
        "body": {
          "type": "string",
          "description": "HTTP response body consumed by Core remote-reading rules."
        },
        "status": {
          "type": "integer",
          "minimum": 100,
          "maximum": 599,
          "description": "Optional HTTP status code accepted by Core for diagnostics."
        },
        "headers": {
          "type": ["object", "null"],
          "default": {},
          "description": "Optional HTTP response headers accepted by Core for diagnostics."
        }
      }
    },
    "HostErrorParams": {
      "type": "object",
      "additionalProperties": false,
      "required": ["operationId", "error"],
      "properties": {
        "operationId": { "type": "integer", "minimum": 1 },
        "error": { "$ref": "reader-event.schema.json#/$defs/CoreError" }
      }
    },
    "HostSmokeParams": {
      "type": "object",
      "additionalProperties": false,
      "properties": {
        "capability": {
          "type": "string",
          "pattern": "^[^\\s.]+(\\.[^\\s.]+)+$",
          "default": "host.smoke.echo"
        },
        "params": {
          "type": "object",
          "default": {}
        }
      }
    },
    "RuntimeCancelParams": {
      "type": "object",
      "additionalProperties": false,
      "required": ["requestId"],
      "description": "Parameters for runtime.cancel. Cancels an in-flight request by its requestId.",
      "properties": {
        "requestId": {
          "type": "integer",
          "minimum": 1,
          "description": "The requestId to cancel. Must differ from the runtime.cancel command's own requestId."
        }
      }
    },
    "RuntimeStatusParams": {
      "type": "object",
      "additionalProperties": false,
      "description": "Parameters for runtime.status. Must be an empty object."
    },
    "RuntimeShutdownParams": {
      "type": "object",
      "additionalProperties": false,
      "description": "Parameters for runtime.shutdown. Must be an empty object."
    }
  }
}
