{
  "protocolVersion": 1,
  "requestId": 432,
  "method": "runtime.hostSmoke",
  "params": {
    "capability": "webview.evaluateJavaScript",
    "params": {
      "document": {
        "kind": "html",
        "body": "<main id=\"book\">Dune</main>",
        "baseUrl": "https://books.example.test/detail"
      },
      "javaScript": "   "
    }
  }
}
