{
  "protocolVersion": 1,
  "requestId": 606,
  "method": "local_book.catalog",
  "params": {
    "catalog": {
      "schemaVersion": 1,
      "books": [],
      "chapters": [],
      "resources": []
    },
    "entry": {
      "stableBookId": "conformance-book-1",
      "sourceFingerprint": {
        "byteCount": 42,
        "prefixChecksum": "sha256:abc",
        "suffixChecksum": "sha256:def",
        "detectedFormat": "txt"
      },
      "contentFingerprint": {
        "fullInputChecksum": "sha256:full",
        "parserConfigChecksum": "sha256:cfg",
        "normalizedMetadataChecksum": "sha256:meta",
        "chapterLocatorSequenceChecksum": "sha256:loc"
      },
      "semanticFingerprint": {
        "normalizedTitle": "intro",
        "chapterTitleSequenceChecksum": "sha256:titleseq",
        "chapterCount": 1,
        "format": "txt"
      }
    },
    "chapters": [],
    "resources": []
  }
}
